,Unnamed: 0,Вопрос,Ответ,Пункт1,Пункт2,Пункт3
0,1,В какие сроки головная кредитная организация банковской группы должна представить в Банк России отчеты о размере оп риска?,"Головная кредитная организация должна представить в Банк России отчеты о расчетах операционного риска банковской группы не позднее десяти рабочих дней после представления отчетности по форме 0409805 за 1 января расчетного года, при условии соблюдения сроков, установленных в Порядке составления и представления отчетности (Глава 1, пункт 1.3; Глава 2, пункт 2.8).","Головная кредитная организация банковской группы рассчитывает ежегодно размер
операционного риска банковской группы на 1 января расчетного года в сроки, предусмотренные
внутренними документами банковской группы, разработанными головной кредитной организацией
банковской группы для расчета обязательных нормативов банковской группы (далее - внутренний
документ банковской группы), но не позднее срока, указанного в абзаце пятом пункта 3 Порядка
составления и представления отчетности по форме 0409805 ""Расчет собственных средств
(капитала) и значений обязательных нормативов банковской группы"", установленного Указанием
Банка России от 10 апреля 2023 года N 6406-У ""О формах, сроках, порядке составления и
представления отчетности кредитных организаций (банковских групп) в Центральный банк
Российской Федерации, а также о перечне информации о деятельности кредитных организаций
(банковских групп)"" 1
(далее соответственно - Указание Банка России N 6406-У, Порядок
составления и представления отчетности по форме 0409805).","Головная кредитная организация банковской группы устанавливает во внутренних
документах банковской группы порядок и сроки рассмотрения органом управления головной
кредитной организации банковской группы отчетов, указанных в пункте 2.7 настоящего
Положения.
Для расчета размера операционного риска банковской группы f-e участники банковской
группы ежегодно представляют в головную кредитную организацию банковской группы отчет,
указанный в абзаце втором пункта 2.7 настоящего Положения, по состоянию на 1 января
расчетного года в срок, указанный во внутренних документах банковской группы, но не позднее
срока, указанного в абзаце пятом пункта 3 Порядка составления и представления отчетности по
форме 0409805.
Головная кредитная организация банковской группы представляет в Банк России отчеты,
указанные в пункте 2.7 настоящего Положения, по состоянию на 1 января расчетного года не
позднее десяти рабочих дней с даты представления в Банк России отчетности по форме 0409805
""Расчет собственных средств (капитала) и значений обязательных нормативов банковской группы"",
установленной Указанием Банка России N 6406-У, по состоянию на 1 января расчетного года в
соответствии с абзацем пятым пункта 3 Порядка составления и представления отчетности по форме
0409805 или по запросу Банка России в срок не позднее пятнадцати рабочих дней со дня получения
указанного запроса.",
1,2,Как учитываются корректирующие события после отчетной даты при перерасчете размера опер риска?,"При наличии корректирующих событий после отчетной даты, влияющих на показатели КБИ_БГ i и КВП_БГ i, головная кредитная организация должна перерассчитать размер операционного риска банковской группы на 1 июля расчетного года, учитывая изменения в бухгалтерском учете по состоянию на 1 января расчетного года (Глава 1, пункт 1.4; Глава 2, пункт 2.2.1).","В случае если головная кредитная организация банковской группы отражает в
бухгалтерском учете события, подтверждающие существовавшие на отчетную дату условия, в
которых кредитная организация вела свою деятельность (далее - корректирующие события после
отчетной даты), в соответствии с главой 3 Указания Банка России от 4 сентября 2013 года N 3054-У
""О порядке составления кредитными организациями годовой бухгалтерской (финансовой)
отчетности"" 2
, влияющие на расчет величин КБИ_БГ i и КВП_БГ i, головная кредитная организация
банковской группы осуществляет на 1 июля расчетного года перерасчет размера операционного
риска банковской группы, значений КБИ_БГ i и КВП_БГ i на основании отраженных в
бухгалтерском учете корректирующих событий после отчетной даты в сроки, указанные в абзацах
третьем и четвертом пункта 3 Порядка составления и представления отчетности по форме 0409805,
по состоянию на 1 января расчетного года.
","Головная кредитная организация банковской группы рассчитывает на расчетную дату
i-го года величину БИ_КО i,j в соответствии с пунктом 2.2 Положения Банка России N 744-П в
сроки, указанные в пунктах 1.3 и 1.4 настоящего Положения, по состоянию на 1 января расчетного
года с исключением из расчета величины операций и сделок, указанных в пункте 3.10 Положения
Банка России от 3 мая 2023 года N 815-П ""О порядке составления отчетности, необходимой для
осуществления надзора за кредитными организациями на консолидированной основе, а также иной
информации о деятельности банковской группы и правилах составления отчетности, необходимой
для осуществления надзора за кредитными организациями на консолидированной основе"" 1
(далее -
Положение Банка России N 815-П), а также иных операций, указанных в пункте 3.11 Положения
Банка России N 815-П (далее - величина исключений внутригрупповых операций).
",
2,3,"Расскажи про события, которые должны регистрироваться в базе событий для управления опер риском, и какие типы потерь учитываются в расчете?","Для управления операционным риском головная кредитная организация обязана определить порядок регистрации событий операционного риска, включая учет потерь по событиям, зафиксированным в базе событий (Глава 2.6). Прямые потери отражаются на счетах бухгалтерского учета и должны быть зарегистрированы в базе событий, предусмотренной Указанием № 3624-У (Глава 3.12).","В целях расчета размера операционного риска банковской группы головная кредитная
организация банковской группы разрабатывает внутренние документы банковской группы и
определяет в них:
порядок и методику расчета размера операционного риска банковской группы и отдельных
показателей, указанных в пункте 2.3 настоящего Положения;
порядок и методику расчета величины исключений внутригрупповых операций в
соответствии с подпунктом 2.2.1 пункта 2.2 настоящего Положения для j-x участников банковской
группы;
порядок представления информации о событиях операционного риска, реализованных у f-x
участников банковской группы, и потерях по данным событиям в соответствии с отчетом о прямых
потерях от реализации событий операционного риска и возмещениях участника банковской группы
(рекомендуемый образец приведен в приложении 1 к настоящему Положению).
",,
3,4,"Расскажи о порядке взаимодействия с Банком России при расчете размера оп риска, и какие внутренние документы и методики должны быть разработаны?","Взаимодействие головной кредитной организации с Банком России при расчете размера операционного риска осуществляется через личный кабинет в соответствии с Указанием Банка России N 5969-У... (Глава 1.5). Также головная кредитная организация должна разработать внутренние документы, включая порядок и методику расчета операционного риска, а также порядок учета событий риска (Глава 2.6).","Информационный обмен головной кредитной организации банковской группы с Банком
России осуществляется с использованием личного кабинета в соответствии с Указанием Банка
России от 5 октября 2021 года N 5969-У ""О порядке взаимодействия Банка России с кредитными
организациями, некредитными финансовыми организациями, лицами, оказывающими
профессиональные услуги на финансовом рынке и другими участниками информационного обмена
при использовании ими информационных ресурсов Банка России, в том числе личного кабинета"" ","6. В целях расчета размера операционного риска банковской группы головная кредитная
организация банковской группы разрабатывает внутренние документы банковской группы и
определяет в них:
порядок и методику расчета размера операционного риска банковской группы и отдельных
показателей, указанных в пункте 2.3 настоящего Положения;
порядок и методику расчета величины исключений внутригрупповых операций в
соответствии с подпунктом 2.2.1 пункта 2.2 настоящего Положения для j-x участников банковской
группы;
порядок представления информации о событиях операционного риска, реализованных у f-x
участников банковской группы, и потерях по данным событиям в соответствии с отчетом о прямых
потерях от реализации событий операционного риска и возмещениях участника банковской группы
(рекомендуемый образец приведен в приложении 1 к настоящему Положению).",
4,5,Какие показатели должны быть исключены из расчета БИ и какова методика перерасчета при корректирующих событиях?,"При расчете бизнес-индикатора банковской группы головная кредитная организация должна исключить операции и сделки, указанные в пунктах 3.10 и 3.11 Положения Банка России N 815-П (Глава 2.2.1). В случае корректирующих событий после отчетной даты осуществляется перерасчет величин КБИ_БГ и КВП_БГ на 1 июля расчетного года (Глава 1.4).","Головная кредитная организация банковской группы рассчитывает на расчетную дату
i-го года величину БИ_КО i,j в соответствии с пунктом 2.2 Положения Банка России N 744-П в
сроки, указанные в пунктах 1.3 и 1.4 настоящего Положения, по состоянию на 1 января расчетного
года с исключением из расчета величины операций и сделок, указанных в пункте 3.10 Положения
Банка России от 3 мая 2023 года N 815-П ""О порядке составления отчетности, необходимой для
осуществления надзора за кредитными организациями на консолидированной основе, а также иной
информации о деятельности банковской группы и правилах составления отчетности, необходимой
для осуществления надзора за кредитными организациями на консолидированной основе"" 1
(далее -
Положение Банка России N 815-П), а также иных операций, указанных в пункте 3.11 Положения
Банка России N 815-П (далее - величина исключений внутригрупповых операций).","В случае если головная кредитная организация банковской группы отражает в
бухгалтерском учете события, подтверждающие существовавшие на отчетную дату условия, в
которых кредитная организация вела свою деятельность (далее - корректирующие события после
отчетной даты), в соответствии с главой 3 Указания Банка России от 4 сентября 2013 года N 3054-У
""О порядке составления кредитными организациями годовой бухгалтерской (финансовой)
отчетности"" 2
, влияющие на расчет величин КБИ_БГ i и КВП_БГ i, головная кредитная организация
банковской группы осуществляет на 1 июля расчетного года перерасчет размера операционного
риска банковской группы, значений КБИ_БГ i и КВП_БГ i на основании отраженных в
бухгалтерском учете корректирующих событий после отчетной даты в сроки, указанные в абзацах
третьем и четвертом пункта 3 Порядка составления и представления отчетности по форме 0409805,
по состоянию на 1 января расчетного года.
",
